3,吉林省通化县快大茂镇欣欣小学,吉林,通化市,通化县,快大茂镇,刘洁,1998,2017,后续支持,暂停捐赠,不愿意再联系,通化县快大茂镇中心小学 占地面积37521平方米，建筑面积12268平方米。建有200米塑胶跑道，2400平方米的人工草坪，126平方米的观礼台。体育设施齐全，有篮球场地2个、排球场地2个、乒乓球台4个，以及一系列健身器材。现代教育技术装备设施完备，建有38个具有多媒体功能的教室、16个包括计算机室、实验室、声乐室等在内的功能教室和１个“民俗器用陈列馆”，办学条件在省内堪称一流。现有教学班35个，教师132人，学生1569人。,吉林通化县快大茂镇文化街366号134100,0435-5257166,thxkdzzxx@126.com,thxkdzzxx@126.com,13844515864,13844515864,中心小学,1600,130,,5,6,6,6,6,6,,298,208,267,291,238,278,,0,,是,是,有电脑室，共100台电脑，电脑设备老化需要更新,100台,42套,是,38,50000
145,云南威信县双河乡天池村彭周欣欣小学,云南,昭通市,威信县,双河乡,熊明忠,2004,2012,后续支持,暂停捐赠,不愿意再联系,因安全抓得紧，学校需暂停与境外有关的一切活动。,云南省威信县双河苗族彝族天池欣欣希望小学657900,18887028338,851912545@qq.com,330737610@qq.com,15087205511,xmzh19810729,完全小学,113,9,,1,1,1,1,1,1,,19,19,11,17,21,26,,,,是,是,13,1,,是,0,4000
42,湖南湘西吉首市河溪镇思谕欣欣小学,湖南湘西,湘西州,吉首市,河溪镇,张勇,2002,,后续支持,基础设施,中心校加入,吉首市河溪镇阿娜思谕欣欣小学属于河溪学区一所片完小。学校位于峒河之滨，319国道和常吉高速交叉十字路口旁。校园依山傍水，距州市府所在地8公里，享有吉首市南大门之美称。学校占地面积2700平方米，建筑面积1020平方米。现有教师12人，开设年级1至6年级，共有学生120人，学校入学率和毕业率均为100%，2012年被评为州级合格村小。,湖南省吉首市河溪镇阿娜村四组    邮编416014,13467439962,547601594@qq.com,,15080869889,,中心小学,44,8,,1,1,1,1,1,1,,,,,,,,,0,,是,是,,3,1,是,,2000
208,四川省达州市通川区金石镇林氏欣欣中心学校,四川,达州市,通川区,金石镇,王在明,2005,2017,后续支持,基础设施,中心校加入,林氏欣欣基点校的前身系原金石乡柳潭小学，始建于清朝康熙年间。 2005年由美国欣欣教育基金会捐赠一万美元，达县人民政府配套十万元，作为改造校舍和学校设施的经费。于2005年9月由四川升华集团有限公司动工改建，拆除旧校舍，新建混砖结构平房12间，建筑面积450平方米，满足了当时学生入学的需求。 为了感谢华侨林氏欣欣集团的厚爱，铭记深情，2006年1月16日“柳潭小学”正式更名为“林氏欣欣基点校”。现与中心校合并，学生898人，23个教学班，教职工82人。,四川省达州市通川区金石镇中心校 转林氏欣欣基点校 635000,15983867998,jslhb123@126.com,,15983867998,wxid_lwsr05q2kykj22,九年制,898,82,2,2,2,2,2,3,3,,96,99,102,105,122,120,452,680,,是,是,2,10,23,是,0,24000
284,广西壮族自治区百色市乐业县同乐镇武称李维新欣欣小学,广西,百色市,乐业县,同乐镇,王连密,2007,2017,后续支持,基础设施,中心校加入,学校始建于1937年，有37位教师，15个教学班，学生共有524人，学校的办学理念是与感恩为主题,广西壮族自治区百色市乐业县同乐镇武称小学 533200,7767787555,wcxx7802349@126.com,wcxx7802349@126.com,15077666211,15077666211,九年制,610,55,2,2,2,2,2,2,3,70,85,75,70,75,70,81,,404,,是,是,50,35,15,是,,14000
286,广西壮族自治区忻城县思练镇德慧欣欣小学,广西,来宾市,忻城县,思练镇,潘继斌,2007,2017,后续支持,基础设施,中心校加入,忻城县思练镇中心小学教学服务区为全镇一个社区和15个村民委，服务人口6万多人。全镇小学开设1—6年级，共有81个教学班，在校生3740人，学校现有教职工213人，工人1人，安全协管员10人，零就业人员12人，领导班子24人，教师合格率100%。全镇学校占地面积83512平方米，校舍建筑面积15105平方米，生均校舍面积4.38平方米。忻城县思练镇中心小学一校区（2011年2月撤点并校后迁入原思练镇初级中学），占地面积30709.8平方米（约47亩），是忻城县目前最大的寄宿制小学。,广西壮族自治区忻城县思练镇德慧欣欣小学 000000,7725772171,slxx171@163.com,panjibin6@163.com,13978203065,wxid-8oato9vibmu622,中心小学,3740,213,0,3,5,4,11,10,10,0,541,605,692,641,564,605,,1810,,是,是,70,30,41,是,38,63330
292,四川省巴中市南江县高塔镇金盆硅谷女性欣欣小学,四川,巴中市,南江县,高塔镇,张斌,2007,2018,后续支持,基础设施,中心校加入,我校始建于1958年，是典型的山区农村完全小学，海拔高度900余米，学校服务半径5公里，覆盖下去6个行政村和一个社区5000余人口。学校占地面积为7950平方米，现有教学楼1栋8间，综合楼470平方米，学生宿舍2栋，学生食堂1栋，厕所1栋。建筑面积2500余平方米。现有教职工20人，学生52人，三个教学点包括中心校及两所村校。,四川省巴中市南江县高塔镇金盆小学 636623,0827-8256155,156818378@qq.com,156818378@qq.com,18190122791,18190122791,中心小学,53,16,3,1,3,0,1,1,1,7,2,8,0,12,8,15,,24,,是,是,21,8,2,是,8,5000
297,四川省宜宾县高场镇崇实欣欣小学,四川,宜宾市,叙州区,高场镇,郑能贵,2007,2019,后续支持,基础设施,中心校加入,基本情况 高场镇黄伞小学地处岷江河畔黄伞乡腹地，位于大华村13组。整个校园被山水环绕，可谓是依山傍水，天空时见成群的白露飞过，是一个理想的学习之地。 该校原名肖家祠，始建于明代末年，当时是一个四合院，全属木结构。解放后1950年，肖家祠没收国有，同年9月，内部房间稍经改造，办起了黄伞乡中心校。当时有4个教学班，7个教师，到1951年才完全办起了小学校，原名为“宜宾县高场区黄伞乡中心校”，1980年调整为九年一贯制学校；2006年经“资源整合”后，为现在的宜宾县高场镇黄伞小学校，属于一所基点学校，也属于“欣欣小学”，下属两个村小，分别是涂坝小学和公民小学。 校舍经过多次改造，四合院的影子于2012年彻底没有了，同年，新教学楼动工修建，2013年验收使用，一幢三层的教学楼，拔地而起。学校占地面积7727平方米，现有6个年级6个教学班；幼儿园：大班、小班各1个，学生总人数297人。全校教师共15人，其中本科4人，专科10人，中师1人；小学高级教师3人，市级骨干教师1人。  学校为孩子们的学习提供了一部分硬件设施、设备，图书室、实验仪器室、电子白板室、幼儿园休息室，为孩子们的全面发展提供了有力保障。  办学理念 多年来，黄伞小学积极推进素质教育，努力提高教育教学质量，创建具有田园特色的新型乡村学校，结合实际，以“全面发展、提高素质、培养能力、发展个性”为办学理念。 办学特色 多年来黄伞小学形成了自己的办学特色：一是让孩子们享受学习与成长的快乐。学校除了给孩子们提供学习科学文化知识外，还开设了羽毛球、跳绳、舞蹈、乒乓球等各种兴趣小组，让孩子们充分感受到学习与成长的快乐。  当你听到“每天锻炼一小时，健康成长多快乐！”时，这是黄伞小大课间时间到了。每天第二节课眼保健操一结束，同学们就迅速排好队，踏着音乐节奏有序来到操场上，进行“1+x”活动。学校还以每年的5月、12月为学生才艺展示月。 二是让孩子们全面发展。学校成立了学生会，并分为5个部，即学习部、卫生部、纪检部、文艺部和体育部，分别由三年级以上优秀学生组成，形成自我管理、分工合作的形式。每天的两操他们都积极主动地回到自己的岗位上，包括每个星期一的升旗仪式，也由学生会主持并总结上周情况，让他们逐渐学会自己管理自己，并看到自己的不足，这样不仅锻炼了孩子们的胆量，还培养了他们的管理、合作能力及自我约束力。     三是有规所循。即以“强师德、树形象、练,四川省宜宾县高场镇大华村13组 644609,18148467839,3399313950@qq.com,2625479006@qq.com,13688289218,e02b17319,中心小学,168,12,3,1,1,1,1,1,1,84,37,28,31,29,32,28,0,0,,是,是,30,6,0套,是,0,2000
262,广西壮族自治区金秀县罗香乡李门欣欣中心小学,广西,来宾市,金秀瑶族自治县,罗香乡,陈开民,2006,2017,后续支持,师资培训,中心校加入,,广西省来宾市金秀县罗香乡罗香街10号545704,18377206267,jxluoxiang@163.com,451833146@qq.com,18377206267,wla005,完全小学,572,56,,8,7,5,4,3,4,,101,91,91,86,84,119,,180,,是,是,70,30,20,是,,10000
51,湖南省湘西花垣县龙潭镇广恩欣欣小学,湖南湘西,湘西州,花垣县,龙潭镇,王治安,2003,2019,后续支持,教学设备,中心校加入,学校于民国期间，由当地绅士集资办创，学校坐落于龙潭镇草坪村，学生来源于草坪、金溶、龙鼻嘴三个村12个自然寨，村民人口3987人。学校距离县城25KM。解放后，学制为九年一贯制义务教育学校，1980年9月1日被县教育局命名为龙潭镇草坪小学。1991年7月由美籍华人创办欣欣教育基金会，捐款20000美元，新修了一栋600多平方米的教学楼，更名为“龙潭镇草坪广恩欣欣小学”，现有3个教学班，在校学生42人。目前校园占地面积3359平方米，校舍建筑面积858.43平方米；2017年给教学楼增建一个楼梯。,湖南省花垣县龙潭镇草坪村   416403,7432179032,470621874@qq.com,33172445@qq.com,13974375606,hycl12o3,中心小学,968,67,,,,,,,,,,,,,,,,0,,否,否,,0,,,0,
68,宁夏海原县西安乡小河华华欣欣小学,宁夏,中卫市,海原县,西安乡,方宁,2003,2017,后续支持,教学设备,中心校加入,"西安中心小学创建于1937年，是一所历史悠久，具有深厚文化底蕴的乡镇级中心小学。服务范围6个自然村，有西安东西街、北坝村、老城村、柴塘村、杨庄村、付套村，人口总数6123人。学校占地面积20801平方米；建筑面积5626平方米；教学辅助用房2594平方米（其中学生宿舍120平方米）；体育运动场8000平方米。现有14个教学班，在校学生419人，寄宿生96人，现有专任教师29人，其中女教师18人，中师学历2人，大专学历9人，本科学历18人。有4名教师被评为市级骨干教师	1名教师被评为县级骨干教师。",宁夏海原县西安镇西安中心小学 755208,13723343419,ljzhappy@163.com,287337279@qq.com,,,中心小学,419,29,0,0,0,0,0,0,0,0,0,0,0,,,0,,56,,是,是,45,25,12,是,,15000
2,吉林省白城子市镇贲县坦途镇第二中心欣欣小学,吉林,白城市,镇赉县,坦途镇,齐向前,1998,2017,后续支持,基础设施,原欣欣学校,"坦途二小始建于1962年，是地处“吉黑蒙”三省交界的一所农村中心小学校。现有六个教学班学生59人，，教师39人，校园面积2万平方米。营养餐试点学校，现有校车一台	班班多媒体。",吉林省镇赉县坦途镇第二欣欣中心小学校137304,0436-7768196,404299428@qq.com,2670051263@qq.com,13766111855,13766111855,中心小学,59,39,1,1,1,1,1,1,1,0,7,13,2,7,20,10,,午休59人,,是,是,有电脑室无电脑,10台,3套,是,,1500
12,黑龙江省望奎县恭六欣欣希望小学,黑龙江,绥化市,望奎县,龚六乡,古浩,2000,2017,后续支持,基础设施,原欣欣学校,我校位于望奎县东北部离县城100华里，是望奎县距离县城最远的一个乡小学，我校始建于1933年，现有学生203人，幼儿20人，教职工53人。,黑龙江省望奎县恭六乡恭六村152182,13836405556,wkxglxx@163.com,wkxglxx@163.com,13836405556,gh635555,中心小学,223,53,1,2,2,2,2,2,,25,26,38,33,46,66,,,110,,否,否,,4,2,是,10,7500
20,湖北省潜江市熊口镇万德固李蕴华伉俪纪念小学,湖北,潜江市,潜江市,熊口镇,陆光兵,2001,2019,后续支持,基础设施,原欣欣学校,莲市万德固李蕴华伉俪纪念小学是一所村级中心小学，始建于1995年元月。主要服务于周边洪庄、中务垸、白果树和莲花寺四个行政村。学校占地面积26000平方米，建筑面积3357平方米，现有在校学生150人，专任教师16人，其中党员5人，具有中学高级教师职称2人，小学高级教师职称5人，本科学历教师9人。,湖北省潜江市熊口镇433136,0728-66369911,1332149350@qq.com,1691571431@qq.com,13545957744,lgb7774444,完全小学,128,14,0,1,1,1,1,1,1,,27,30,28,31,31,33,0,0,,是,是,30,2,6,是,,
23,四川省宜宾市长宁县吴哲儒欣欣小学,四川,宜宾市,长宁县,长宁镇,侯业新,2002,2019,后续支持,基础设施,原欣欣学校,,四川省宜宾市长宁县长宁镇吴哲儒欣欣小学644300,15181198699,,,13219511523,hyx13219511523,村小,91,7,,,,,,,,,,,,,,,,,,,,,,,,,
24,湖南湘西花垣县花垣镇思谕欣欣小学,湖南湘西,湘西州,花垣县,花垣镇,向德明,2002,,后续支持,基础设施,原欣欣学校,团结镇思谕欣欣小学原名为团结镇下瓦水小学，位于花园县城西北10公里、省道231路旁。创建于1935年，2002年由欣欣教育基金会出资重建，更名为团结镇思谕欣欣小学，学校占地面积约12亩，共有两栋教学楼，建筑面积4700平方米，有教室、电脑室、图书室、食堂等教育设施14间。学校环境优美，干净整洁，绿树成荫，为实施素质教育提供了良好的条件。学校现有5个义务教育教学班和一个幼儿班。,湖南省湘西州花垣县团结镇下瓦水村 416401,15387439551,xiangdeming168@163.com,xiangdeming168@163.com,15387439551,W15387439551,村小,51,6,1,1,1,1,1,1,,7,12,8,8,8,8,,,0,,是,否,0,0,0,是,,420
29,辽宁省丹东市振安区宋氏欣欣小学,辽宁,丹东市,振安区,同兴镇,王庆军,2002,,后续支持,基础设施,原欣欣学校,我校现阶段有很多的基础设施在进一步完善，如厕所已经由旱厕改建成水厕，幼儿园和食堂的建设还在进一步完善。希望欣欣能够帮助我校完善，使孩子们有个好的环境投入到学习当中！特此恳求！,辽宁省 丹东 縣(市) 同兴 鄉(鎮) 五道 (村)118003,0415-2595269,ddtxz@163.com,,13941578618,13941578618,中心小学,521,67,,3,3,3,3,3,3,,108,84,78,93,88,70,,无,,是,是,30,8,2,是,,21680
31,福建省武夷山市吴屯乡龚履端欣欣小学,福建,南平市,武夷山市,吴屯乡,姚承辉,2002,,后续支持,基础设施,原欣欣学校,"武夷山市吴屯乡中心小学位于福建省武夷山市北郊	北临闽赣交界线	南倚“奇秀甲天下”的世界自然、文化遗产地武夷山，座落在风景秀丽的省重点水利工程东溪水库湖畔。  吴屯中心小学，创办时间为1909年（清宣统元年）10月，创办人占秉良，地点原设吴屯乡街路村街尾，原名吴屯简小，1937年2月改为吴屯初小，1941年8月改为吴屯中心学校，1987年8月与吴屯乡吴边小学合并为吴屯乡中心小学，同时迁址至吴屯乡街路村桥头。历任校长25人，现任校长姚承辉。",福建省武夷山市吴屯乡街路村10号354309,0599-6035205,wtlcj283@163.com,XTCCYCH@126.com,13799105985,13626953701,中心小学,239,59,,1,1,1,1,2,2,,37,28,33,27,46,68,,40,,是,是,32,13,11,是,9,13920
32,湖南省平江县三墩乡振华小学,湖南,岳阳市,平江县,三墩乡,苏团辉,2002,2019,后续支持,基础设施,原欣欣学校,我校位于平江山区，山清水秀，民风淳朴。学校师生共有55人。我校建于2003年，在爱心人士的帮助下，解决了我村学生的上学难的难题，同时也为我校后来的发展带来了契机，现学校条件日益改善，学生逐渐发展全面。再各界人士的帮助下，我校会越走越辉煌、越来越完善。,湖南省岳阳市平江县三墩乡志坪小学414500,14789600505,1016773601@qq.com,3443173832@qq.com,13575053798,yl138_,村小,68,5,1,1,1,1,1,1,,18,15,8,6,15,8,,,无,,否,是,11,1,无,否,,
34,安徽省当涂县湖阳乡大刑欣欣小学,安徽,马鞍山市,当涂县,湖阳乡,邢庆云,2002,2017,后续支持,基础设施,原欣欣学校,学校创建于1950年，原校舍年久失修，破烂不堪。2002年在欣欣教育基金的支持下新建教学楼，校容校貌焕然一新。,安徽省当涂县湖阳镇243159,5556113309,1813826284@qq.com,1813826284@qq.com,15955516395,,完全小学,120,7,0,1,1,1,1,1,1,,12,24,26,13,23,22,,0,,是,是,21,8,1,,,
35,四川省南充市西充县同德乡欣欣小学,四川,南充市,西充县,同德乡,崔成兵,2002,2014,后续支持,基础设施,原欣欣学校,学校比较偏远，距离西充县城37公里，现有在校学生（初中、小学、幼儿班）374人，留守学生在88%以上，教职工31人。学校近三年完成教学楼建设，学生公寓建设，运动场地建设，校园环境得到极大改善。教育教学质量逐年攀升。2020年获得片区教学质量评价一等奖、全县初中教学质量评价二等奖、小学教学质量评价三等奖，年终综合评估全县二等奖、西充县教育工作先进集体等荣誉，被教育部关工委评新时代好少年读书活动先进集体。2021年小学质量评估县三等奖，初中质量评估二等奖。,四川省西充县同德乡场镇   637200,0817-8863599,464626083@qq.com,464626083@qq.com,13219112563,15892762878,九年制,316,45,2,1,1,1,1,1,1,46,33,34,36,38,45,43,99,142,,是,是,36,10,5,是,11,8650
38,吉林省通榆县羊井乡黎明村小学,吉林,白城市,通榆县,羊井乡,韩鹏环,2002,,后续支持,基础设施,原欣欣学校,为适应通榆县域经济的快速发展，2012年7月份，通榆县政府利用职教集团原址与开通镇羊井小学合并成立第二实验小学（又名：通榆县欣欣实验小学）。 这是一所寄宿走读双轨制学校。具有一流的现代化的教学设施。班级均有多媒体教学设施。住宿环境优雅，设施均是全新的配置，条件一流。教育局本着公开竞争、折优录用的原则，选拔业务精英组建高素质的教师队伍。教育局决心把这所学校打造成集实验性、研究性、示范性为一体的现代化、精品化学校。学校以高起点、高标准、高品位、高质量为特色，力创通榆县的“亮点校”、“窗口校”和“精品校”。,吉林省通榆县开通镇新发街3562-11，137200,13843641229,396370481@qq.com,,13843641229,13843641229,完全小学,1634,112,,6,6,6,6,6,6,,272,249,280,287,269,277,,67,,是,是,24,16,36,是,36,48560
41,湖南湘西吉首市排吼乡思谕欣欣小学,湖南湘西,湘西州,吉首市,排吼乡,陈君明,2002,,后续支持,基础设施,原欣欣学校,学校始建于1953年（原名为冲口学校），2001年美国欣欣教育基金会捐建搬迁后更名为思谕欣欣小学。学校现设有一至二年级两个班，有教职工1人，学生数13人，属吉首市太平镇排吼学校中心完小下属教学点。学校于2018年完成教学点的合格学校验收，现各项教学设施设备配备完善，更有利于学校教育教学发展，方便周边村寨学生就近入学。,湖南省吉首市排吼乡茶群村416000,0743-8630363,453693653@qq.com,,17374342929,,教学点,13,1,1,1,1,,,,,,,,,,,,,,,,否,,,,,,
44,湖南湘西凤凰县禾库镇广恩欣欣小学,湖南湘西,湘西州,凤凰县,禾库镇,石忠林,2002,2018,后续支持,基础设施,原欣欣学校,,湖南省凤凰县禾库镇龙角村 416209,7433690037,390898897@qq.com,,13574328249,,村小,48,3,1,1,1,1,,,,19,10,12,7,,,,,,,,,,,,,,
45,湖南省常德市汉寿县军山铺镇中学欣欣永嘉综合楼,湖南,常德市,汉寿县,军山铺镇,刘波,2003,2018,后续支持,基础设施,原欣欣学校,"军山铺镇中学地处常益交界处、常德南大门—汉寿县军山铺集镇，距319国道仅100米，距长常高速公路军山铺收费站400米，交通条件十分便利。 学校现有占地面积 28985平方米，建筑面积 12099 平方米，实践教育基地40亩。现有在校六年级262人，初中学生762人	 专任教师56人；其中初级职称23人、中级职称25人、高级职称8人，管理人员2人。是汉寿县的乡镇大校之一，是常德南陲的窗口学校，是享有盛誉的质量名校。",湖南常德市汉寿县军山铺镇中学 415901,7362279888,350762950@qq.com,80669939@qq.com,13786606989,,初中,1108,56,,,,,,,5,,,,,,,256,862,580,,是,是,48,10,,,21,
49,湖南省湘乡市育段乡育仁欣欣小学,湖南,湘潭市,湘乡市,育塅乡,顾勰茜,2003,,后续支持,基础设施,原欣欣学校,育仁欣欣学校，是一所全日制农村寄宿制学校。占地面积8700平方米，现有教师43人，其中小学高级教师32人，湘潭市优秀教师8人，湘潭市优秀班主任7人，湘潭巾帼标兵1人。现有教学班14个，共有学生800多人，寄宿生217人。我校的发展目标是：乡示范学校，市一流学校，省知名学校，与世界牵手学校。以“自信、勤奋、创新、快乐”为校训。学校荣获：湖南省留守流动儿童示范性家长学校、湘潭市巾帼文明岗、红旗大队、三八红旗集体、合格学校建设先进单位，湘乡市教育教学管理先进单位、湘乡市控流保生先进单位、湘乡市德育工作先进单位等,湖南省湘乡市育塅乡育塅村  411400,13875206744,1608715462@qq.com,,13875206744,,完全小学,756,48,2,2,1,2,2,2,3,87,110,56,117,139,146,165,,300,,是,是,31,3,1,是,0,7000
52,湖南省湘西吉首市矮寨镇广恩欣欣小学,湖南湘西,湘西州,吉首市,矮寨镇,龙云贵,2003,,后续支持,基础设施,原欣欣学校,学校始建于1954年（名为矮寨镇洽比小学），2014年美国欣欣教育基金会捐建后更名为广恩欣欣小学。学校现设有一至二年级两个班，有教职工2人，学生数9人，属吉首市矮寨镇民族完小下属教学点。学校于2015年完成教学点的合格学校验收，现各项教学设施设备配备完善，更有利于学校教育教学发展，方便周边村寨学生就近入学。,湖南省吉首市矮寨镇矮寨社区十二组416000,7438662145,1609234546@qq.com,1609234546@qq.com,13739030067,,中心小学,637,55,1,2,1,2,2,3,3,46,68,47,109,107,137,123,,413,,是,是,50,20,3,是,,24600
53,湖南省湘西保靖县杨隆祜三小,湖南湘西,湘西州,保靖县,普戎镇,彭远淑,2003,,后续支持,基础设施,原欣欣学校,楊隆祜欣欣小學属于保靖县普戎九年一贯制学校的下属教学点，学校有教学楼一栋，教师宿舍一栋。目前学校只有一名教师，8名幼儿园学生，没有义务教育阶段学生。随着社会的进步发展该区域的学生大多数到镇中心学校和城里学校就读，生源得不到保障学校处于自然消亡状态。,湖南省湘西州保靖县普戎镇下垻村 416511,13974348177,,,13487412036,13487412036,教学点,8,1,,,,,,,,8,,,,,,,,,,是,是,,·,,,,
54,湖南省湘西芦溪县上堡乡梁继焜纪念学校,湖南湘西,湘西州,泸溪县,上堡乡,张斌,2003,,后续支持,基础设施,原欣欣学校,我校竣工于2003年11月，2004年春季正式使用。当时在职教师23人，学生数近400人。由于打工潮及城市化进程的影响，导致生源逐年不断下降。目前在编教师9人，其中中小学一级教师6人，中小学高级教师3人，中师学历6人，大专学历3人。在校学生61人，其中建档立卡贫困户学生37人，留守学生35人。    学校办学一来，先后建成了标准化的篮球场、塑胶环形跑道、体育器材健身活动场地、封闭式的校园围墙、花草树木绿化带、水泥地面活动场所及水泥地面人行道路，校园文化宣传墙、体育器材室、仪器室、实验室、美术室、计算机室、,湖南省湘西泸溪县白沙镇416100,135-1743-5903,,,13787901162,,完全小学,61,16,1,1,1,1,1,1,1,,,,,,,,,0,,是,否,,2,,是,,10000
61,四川省筠连县罗昔安欣欣小学,四川,宜宾市,筠连县,巡司镇,郭鑫,2003,2019,后续支持,基础设施,原欣欣学校,罗昔安欣欣小学座落在民主村与冒古村交界之处，与巡牛公路相邻，这里的山环水抱，风景优美，我校现有教师10人，其中中级教师3人，初极教师6人，市级骨干教师1人，有7个教学班级，现有学生137人，学校占地面积8300多平方米。       1992年前，民主小学的教室是利用过去的祠堂，92年后由村、组等筹集材料，投工投劳修建了6间简易教室和办公室。       于2003年春我校得到县教育局。县政府、乡政府、乡中心校及美国教育基金会的支持和帮助，于2003年举行奠基仪式，至2004年5月25日竣工，投入使用。,四川省筠连县巡司镇民主村2组645261,13890435801,1280135799@qq.com,1280135799@qq.com,13890435801,gx1280135799,村小,135,11,1,1,1,1,1,1,1,13,21,18,16,24,24,21,0,,,是,是,22,2,无,是,,1500
