349,贵州省纳雍县玉龙坝镇霞音欣欣小学,贵州,毕节市,纳雍县,玉龙坝镇,何远达,2018,2018,后续支持,基础设施,原欣欣学校,,贵州省纳雍县玉龙坝镇仓边社区四组（果比小学）553307,15308577293,515348587@qq.com,515348587@qq.com,15308577293,h3691655,完全小学,338,18,1,1,1,1,1,1,1,61,35,42,47,54,47,52,0,0,,是,否,,8,,否,0,7378
350,四川省美姑县哈洛乡莘幸欣欣小学,四川,凉山彝族自治州,美姑县,哈洛乡,阿合解哈,2018,,一期支票,基础设施,原欣欣学校,"学校现有占地面积8647.53㎡，校舍建筑面积5618.77㎡。 教学及辅助用房面积680㎡，体育运动场馆面积420㎡	学生计算机台数46台，图书0册，教室12间，学生宿舍8间。 现有教学班8个，在校学生397名，教职工28名，教师岗位设置高级职称1人，中级职称3人。",四川美姑县哈洛乡哈洛村7组  616451,18009010291,,409038814@qq.com,18009010291,geha513436,中心小学,396,25,,1,2,2,1,1,1,,30,99,106,49,58,51,,276,,是,是,48,6,,否,,
352,湖北省兴山县叶开泰欣欣中心小学,湖北,宜昌市,兴山县,榛子乡,榛子乡中心小学,2019,2019,后续支持,基础设施,原欣欣学校,,兴山县榛子乡幸福村三组50号 000000,13872535609,361988949@qq.com,478029318@qq.com,13872535609,,中心小学,97,22,,,,,,,,,,,,,,,,,,,,,,,,,
353,湖南省娄底市新化县荣华乡慕贞欣欣小学,湖南,娄底市,新化县,荣华乡,周世雄,2019,2020,后续支持,基础设施,原欣欣学校,,湖南省新化县荣华乡田果村     417615,13007385339,,285981733@qq.com,13007385339,,中心小学,657,16,,2,2,2,2,2,1,,131,145,102,93,114,72,,0,,否,否,,0,,否,0,0
354,湖南省祁阳县下马渡镇梅芙欣欣中心小学,湖南,永州市,祁阳县,下马渡镇,刘海洋,2020,,后续支持,基础设施,原欣欣学校,下马渡镇中心小学创办于1967年，2000年镇调整学校布局，更名为下马渡镇中心小学。学校距县城3.5千米，地处下马渡镇中心地段，交通便捷，生源辐射半径大，生源广，有着悠久地办学历史和深厚的文化底蕴。目前，学校占地面积11165.5平方米，其中校舍建筑面积3872平方米。全校现有17个教学班，学生700人。为化解大班额，学校已经一室多用，导致没有足够的功能室，也没有相应的办公教室，同时还缺少办公电脑。,湖南省永州市祁阳市下马渡镇大湖塘村，426100,15874619877,316460810@qq.com,316460810@qq.com,15874619877,lhy390752,中心小学,699,42,,3,3,3,3,3,2,,93,111,126,118,143,109,,121,,,否,,3,1,是,1,16472
9,云南省楚雄彝族自治州牟定县青龙乡河节冲欣欣侨心小学,云南,楚雄彝族自治州,牟定县,青龙乡,王启才,1999,2017,后续支持,师资培训,原欣欣学校,牟定县是国家级贫困县，该校位于牟定县，始建于民国末年，有近一百年办学历史。据当地人介绍，牟定县人民乐于接受外来观念与思路，在整个云南省的县里面都很有名，比较聪明，家长对教育也很重视，因而孩子们也相较比较活跃和聪慧。教育成果卓越，广受褒奖。2005年，青龙乡撤乡并镇，划归至凤屯镇，因而校名有所更改。,云南省牟定县凤屯镇河节冲村委会彭家。邮政编码：675506,0878-5333853,1411224850@qq.com,480521790@qq.com,13577806405,,完全小学,66,7,1,0,1,1,1,1,1,5,0,0,11,13,9,20,,28,,否,否,,1,1,是,,
85,江西省奉新县冯川镇思谕第一欣欣小学,江西,宜春市,奉新县,冯川镇,余秋妹,2003,,后续支持,师资培训,原欣欣学校,奉新县冯川镇思谕第一欣欣小学是一所正在发展完善中的完全小学。 在教育改革的浪潮中，她顺应时代发展要求，积极践行“做最好的我”的教育信念;努力构建“以人文精神见长，以科学文化显优，以创新实践成才”的办学模式;在“育人为本，质量第一，突出特色，全面发展”的办学理念的指导下，培养出一支师德高尚、业务精湛、充满活力的专业化教师队伍。 学校先后获得了“江西省优秀课题示范校”、“江西省读书活动先进学校”、“江西省现代教育技术示范学校先进单位”、“宜春市素质教育示范学校”等荣誉称号。,江西省奉新县冯川镇应星路50号   330700,18770571808,jxzhouwenbing@163.com,,13870560267,,完全小学,3146,116,0,6,8,7,7,8,6,0,434,650,520,504,599,439,,/,,是,是,45,5,42,是,42,37800
89,青海省互助土族自治县东沟乡卡子修贞欣欣小学,青海,海东市,互助土族自治县,东沟乡,刘峰,2003,,后续支持,师资培训,原欣欣学校,东沟乡中心学校位于互助县东北部，座落在巍峨的祁连山支脉龙王山脚下。卡子教学点其前身为卡子沟小学，随着学校布局调整，于2009年9月设为教学点。卡子教学点占地面积960平方米，现有2名教师，开设一、二两个年级，共有学生22名。,青海省互助土族自治县东沟乡卡子村，邮政编码：810500,13897323756,390148059@qq.com,1065626181@qq.com,18097013100,lf760521,教学点,22,2,,1,1,,,,,,10,12,,,,,,,,否,否,,0,1,否,2,680
97,湖南省湘西龙山县石羔镇飞鹏欣欣小学,湖南湘西,湘西州,龙山县,石羔镇,贾建涛,2004,,后续支持,师资培训,原欣欣学校,飞鹏欣欣小学建校历史悠久，占地面积3128平方米，1997年在州、县及希望工程关怀下修建一栋680平方米教学楼。2004年得到美国欣欣教育基金的帮助修建了一栋554平米的教学楼。至此，现有教学楼两栋，教学室16间，还配备了仪器室、实验室、图书室、音乐室、美术室等。 本世纪初，在美国欣欣教育基金会的大力帮助下，学校一度达到辉煌。近年来，学校教学稳定发展，在设施方面没有更新，趋于落后。需要积极改善校园环境，做到均衡发展，真正地将飞鹏欣欣小学办成一所优质学校。,湖南省湘西州龙山石羔镇正南村（邮政编码：416800）,7436767079,2662484584@qq.com,271302612@QQ.com,13787431991,hei1999,完全小学,417,25,2,2,2,1,2,1,2,,,,,,,,,,,是,是,20,4,2套,是,,5000
138,宁夏西吉县吉强镇苟庄李实欣欣小学,宁夏,固原市,西吉县,吉强镇,程宗礼,2004,2017,后续支持,师资培训,原欣欣学校,苟庄村位于西吉县吉强镇西南3.5千米处，全村共有人口1820人。苟庄小学创建于1955年。2004年，由自治区侨务办牵头，美国欣欣教育基金会李实先生捐款壹万美元，县人民政府筹措资金21万元，对学校进行整体改造，并更名为苟庄李实欣欣小学。学校占地面积3826平方米，有8个教学班，在校学生共112人，其中女生52人，回族女生43人。学校共有教师11人，其中女教师6人，大学1人，大专4人，中师5人。,宁夏省固原市西吉县吉强镇苟庄村（邮编756299）,13469543730,1007134960@qq.com,,18995411889,wxid_ta89jseg3vo322,完全小学,112,11,2,1,1,1,1,1,1,,,,,,,,,,,是,是,20,2,无,是,,
174,海南省三亚市吉阳区红沙小学广恩欣欣教学楼,海南,三亚市,吉阳区,红沙社区,梁春梅,2005,2018,后续支持,师资培训,原欣欣学校,学校占地面积10346.37平方米，总建筑面积7772平方米。学校的建筑全部是楼房，消灭危房。设综合楼一幢，里面配备有实验室、仪器室、电脑室、音乐室、美术室、心理咨询室、舞蹈室、多媒体阶梯教室、图书阅览室、藏书室、体育器材室等功能室；有教师宿舍楼两幢，共有32套教师住宅房(包括工作间)；有一幢两层的学生公共厕所；办公楼一幢，教学楼一幢，教室40间，宽敞明亮，彩光透风性能好。学校有学生运动场面积3302平方米，包括226米环形塑胶跑道；一个小型篮球场；一个小型足球场。另有体育组合架一套，室外兵乓球台5个。,三亚市吉阳区红沙小学572000,0898-88671359,1653982166@qq.com,1653982166@qq.com,18389913822,18389913822,完全小学,575,38,0,2,2,2,2,2,2,0,95,113,79,56,65,66,0,0,,是,是,61,32,1,是,14,15780
186,甘肃永登县柳树乡欣欣民族小学,甘肃,兰州市,永登县,柳树乡,张彩萍,2005,2016,后续支持,师资培训,原欣欣学校,欣欣民族小学坐落在柳树镇复兴村，全校有教师14人，学生119人。各教室都有电子白板，有微机室，电脑10台。全校有六个班，学风正教风好，是全镇一流的学校，教学成绩在全镇名列全茅，社会影响好。,甘肃省永登县柳树镇欣欣民族小学730306,18993292016,1697217647@qq.com,516545415@qq.com,13919475618,13919475618,完全小学,109,16,0,1,1,1,1,1,1,,23,22,25,24,12,13,0,0,,是,是,有，10台,2,6,是,1,3460
215,新疆博尔塔拉蒙古自治州博乐市达勒特镇雪芳欣欣小学,新疆,博尔塔拉蒙古自治州,博乐市,达勒特镇,于瑞生,2005,2012,后续支持,师资培训,原欣欣学校,,新疆博尔塔拉蒙古自治州博乐市达勒特镇雪芳欣欣小学 833413,0909-6773450,,156353157@qq.con,13899434543,13899434543,完全小学,754,157,3,4,4,4,5,4,5,120,129,127,131,138,117,112,,260,,是,是,40,30,20,是,,20000
220,湖北省阳新县太子镇瑞兰欣欣完全小学,湖北,黄石市,阳新县,太子镇,黄强,2005,2014,后续支持,师资培训,原欣欣学校,我校位于湖北省阳新县的父子山附近，大冶县大冶湖畔，现在隶属黄石市经济技术开发区管辖。我校在黄召水校长的理念下进行新时代教育大发展以来，学校现有学生约600余人，教师24人，厨工3人，保安1人，总面积大约10亩，教学楼2栋，其中一新一旧，新建了厨房，还有基金会赞助建的教师宿舍楼等，教育质量在镇上中上等。,湖北省阳新县太子镇大洪村435214,13886480692,2283849386@qq.com,,13872133195,13872133195,完全小学,588,24,4,3,2,1,1,1,1,200,145,90,45,41,38,34,,60,,否,是,12,,1,是,,
228,湖南湘西花垣县民乐镇仲浩欣欣中心小学,湖南湘西,湘西州,花垣县,民乐镇,麻刚,2005,,后续支持,师资培训,原欣欣学校,我校位于花垣西南部，湘、黔、渝两省一市交汇处的民乐镇。学校始建于清朝光绪三十一年（1905年），原名为永绥厅第二十初等正繁小学堂。民国建立后曾更名为“永绥厅第六区第一国民学校”，1941年扩建为弭诺乡中心小学，校址设在弭诺老云盘。新中国成立后，民乐公社党委、政府发动群众集资办学，兴建民乐中心完小，校址迁至北门口（现址），校名更改为民乐镇中心小学。属少数民族集聚地区，距县城37公里，交通方便，区位优势明显，镇墟场已成为湘、黔、渝两省一市边区的物质聚散地。小城镇建设使镇面貌焕然一新，促进了全镇经济的发展。经济的振兴促进了教育的发展。我校现有在校生1321人，其中：一至六年级1075人，幼儿园有学前幼儿246人。有24个教学班，其中：一至六年级有20个教学班，幼儿园有4个教学班。现有教职工66人。,湖南省湘西州花垣县民乐镇民乐村。416405,13574367160,mlxxswa@163.com,33172445@qq.com,18874381009,,中心小学,1187,62,4,2,2,4,4,4,4,246,120,125,216,202,201,211,,100,,是,是,50,12,2,,,
250,安徽省黄山市歙县霞江竞民欣欣小学,安徽,黄山市,歙县,上丰乡,叶亚军,2006,2018,后续支持,师资培训,原欣欣学校,霞江小学建校历史悠久，有100多年的建校历史。学校位于歙县上丰乡霞江村中央，环境优美，是上丰中心学校的窗口小学。2006年12月学校在美国欣欣教育基金会的资助下，对西边宿舍进行改建，建成300平方米的两层教学大楼。2007年3月竣工，5月投入使用，现命名为“歙县霞江竞民欣欣小学”。,安徽省黄山市歙县上丰乡霞江竞民欣欣小学 245281,15955909860,458189765@qq.com,458189765@qq.com,15955907589,yeyajun650904,教学点,58,6,1,1,1,1,1,1,0,13,11,12,9,13,0,0,0,0,,是,是,17,10,1,是,,500
273,湖北汉川汈汊湖水科所方李邦琴欣欣小学,湖北,孝感市,汉川市,汈汊湖养殖场,邓改红,2007,2014,后续支持,师资培训,原欣欣学校,这是一所秉承着欣欣理念不断前进的学校，她坐落在美丽的刁汊湖畔。在欣欣的帮助下学校办学环境不断改善，教师教育教学水平不断提高。被市教评为教育教学质量先进学校，孝感市示范化学校，汉川市先进文明单位。,湖北省汉川市刁汊湖养殖场刁莲街431627,7128440729,1515523566@qq.com,1764427093@qq.com,15926808676,dgh15926808676,中心小学,220,17,1,1,1,1,1,1,1,22,18,24,18,26,19,25,,无,,是,是,主机3台、分机30台，均由欣欣捐赠。,17台,1,否,,1585
274,山西省晋中市楡次区紫坑德贤慧欣欣小学,山西,晋中市,榆次区,庄子乡,温学利,2007,2016,后续支持,师资培训,原欣欣学校,,山西省晋中市榆次区庄子乡紫坑村  邮编030612,0354-2688578,zzxzkxx@163.com,,15513541067,,中心小学,103,15,,1,1,1,1,1,1,,17,18,19,14,20,15,,27人,,是,是,,,,,,
279,贵州省安顺市西秀区黄腊亲晖欣欣小学,贵州,安顺市,西秀区,黄腊布依族苗族乡,班文勇,2007,2018,后续支持,师资培训,原欣欣学校,黄腊民族小学创建于1953年，位于西秀区东南面，距安顺城区约55公里，是贵州省人民政府命名的一所民族小学。所辖4所村级小学。黄腊民族乡经济单一，地处边远，但黄腊人民历来重视教育，酷爱文化，人才辈出，素有“书法之乡”，“鱼米之乡”，“歌舞之乡”之美誉。     在各级党委，政府及社会各界人士关心支持下，黄腊民族小学办学条件大大改善。校园占地面积4490平方米，校舍面积2648平方米，全片区教职工43人，大专以上学历26人，中级职称30人，共有14个教学班，学生600余人，振兴民族的希望在教育，振兴教育的希望在教师，我校积极鼓励教师在岗培训，不断学习，大力培养业务精良，素质过硬的教师队伍，在全体教职工的共同努力下，普及九年义务教育取得了优异成绩，教育教学质量呈逐年上升之势。,贵州省安顺市西秀区黄腊乡黑秧社区561009,0851-33765008,xxqhlmzxx@163.com.cn,806939322@qq.com,13885334218,ban004218,中心小学,321,33,0,2,2,2,2,2,2,,,,,,,,,80-150,,是,是,36,5,2,,,
294,江苏省沛县朱寨镇欣欣中心小学,江苏,徐州市,沛县,朱寨镇,魏荣华,2007,2017,后续支持,师资培训,原欣欣学校,朱寨镇中心小学创办于1903年，原名为“怀远小学”，后更名为“张柳庄小学”。这所百年老校虽经几易其名，几度迁址，饱经沧桑，但仍焕发出勃勃生机。如今的校园占地35亩，建筑面积4723平方米，教职工98人，32个教学班，在校学生1645人，环境优美，是教师的家园，学生的乐园。近年来，我校发扬自强不息的光荣传统与严谨求实、锐意创新的工作作风，坚持以人为本，以科研促发展的办学理念，全面提高了师生的综合素质，教育教学成效显著。先后荣获 “徐州市足球传统学校”、“县业务工作先进单位”等。,江苏省沛县朱寨镇朱寨村中心小学  221600,0516-69090876,zxxx77@126.com,wrh771129@126.com,18061120699,18061120699,中心小学,1610,85,0,8,8,8,4,4,0,,350,385,356,300,254,,,,,是,是,0,15,4,是,0,16000
329,宁夏回族自治区吴中市同心县预旺镇土峰自强欣欣小学,宁夏,吴忠市,同心县,预旺镇,马迁,2011,2017,后续支持,师资培训,原欣欣学校,预旺镇是一座有着光荣革命传统的古镇，1936年红军西征时驻扎这里，曾经是西征红军播洒革命火种的地方。预旺镇土峰完小坐落在预旺古城以北八公里处惠平公路旁。学校始建于1961年，1998年翻建，2014年补建。学校有监控设备1套，电子白板5台，教师电脑6台，笔记本电脑3台(2018年11月欣欣教育基金会捐赠)，学生电脑14台。,宁夏省吴忠市同心县预旺镇土峰村完全学校，邮编：751305,17795036493,,,18209534378,18209534378,村小,49,6,1,1,1,1,1,0,0,9,8,11,12,9,,0,0,无,,是,是,14,8,1,否,5,1500
9004,陕西省汉中市洋县洋州镇南街小学欣欣阅览室,陕西,汉中市,洋县,洋州镇,王彦军,2009,2016,后续支持,师资培训,原欣欣学校,,陕西省洋县洋州镇南大街101号 723300,0916-8317017,njxxxc@126.com,aaa2296@163.com,15109168099,wyj1290669268,完全小学,3900,200,,9,9,9,10,10,12,,630,650,623,698,859,897,,0,,是,是,2个,220台,90,是,64,150000
27,吉林省白城市通榆县开通镇明德欣欣小学,吉林,白城市,通榆县,开通镇,黄树波,2002,,后续支持,教学设备,原欣欣学校,通榆县明德欣欣小学简介     通榆县明德欣欣小学位于开通镇城乡结合部，是一所招收临时工、农民工、工人、菜农等子弟就读的半封闭式、花园式、标准化公办完全小学。校园总面积25368㎡，建筑总面积8538.9㎡。现有23个教学班，学生804人，其中在校住宿生400人，有教师124人。     该校自2005年以来，在欣欣基金会、台塑集团等社会各界爱心捐助下，成为一所特色鲜明的省级优质学校。被教育部授予“全国教育系统先进集体“、“全国青少年文明礼仪教育示范基地”。,吉林省  通榆县 开通镇 （邮政编码137200）,0436-4265605,tymdxx@126.com,tymdxx@126.com,13504364299,13904364233,完全小学,919,123,2,4,4,4,4,4,4,62,118,99,169,177,176,180,,420,,是,是,50,36,5,是,24,24407
30,吉林省蛟河市前进乡祖博士欣欣小学,吉林,吉林市,蛟河市,前进乡,常趼鑫,2002,2017,后续支持,教学设备,原欣欣学校,,吉林蛟河市前进乡前进村 132517,0432-7031306,jljhjy416@126.com,jljhjy416@126.com,15144364393,,九年制,638,76,2,2,2,2,2,2,2,52,76,62,68,64,59,69,240,,,是,是,51,22,,是,,
46,湖南省石门县磨市镇商溪中学欣欣永嘉教学楼,湖南,常德市,石门县,磨市镇,郑玉才,2003,2018,后续支持,教学设备,原欣欣学校,石门县洞国学校简介       石门县洞国学校（原石门县磨市镇商溪中学）创办于1965年2月，校址位于抗日名将郑洞国将军故里——武陵山片区常德市石门县磨市镇商溪南岳寺村（学校建于郑洞国将军的祖居遗址上）。商溪山青水秀，素有“金仙阳，银渡水，有钱难买商溪水”之美誉；商溪地灵人杰，走出了黄埔精英——抗日名将郑洞国，人民英模——中国工农红军优秀指挥员王尔琢，革命烈士——高级将领毛主席亲家陈振亚（邵华父亲），战斗勇士——开国少将郑国，军中骁将——当代少将郑家概；校址处于商溪河中心地带 ...,湖南省石门县磨市镇南岳寺村，415313,0736-5435109,368646669@qq.com,,13975682913,13975682913,初中,301,28,,,,,,2,2,,,,,,62,65,182,289,,是,是,35,14,交互式班班通9,是,4,3000
48,湖南省长沙县白沙乡杨隆佑二小,湖南,长沙市,长沙县,白沙乡,陈凯,2003,2017,后续支持,教学设备,原欣欣学校,我校地处白沙镇西南端，与福临、开慧两镇相邻，是白沙镇经济欠发达地区，是一所全日制小学，与1976年正式落成开学，现有6个教学班，专任教师8人，共有学生94人。学校秉承“做温暖一生的教育”的办学思想，提出了“让师生拥有幸福生人”的办学宗旨和“开开心心学习，快快乐乐成长”的育人目标，以“快乐阅读、快乐歌唱、快乐运动、快乐创造、快乐学习”为办学新理念。在各级领导的亲切关怀和正确领导下，在社会各界的大力支持和密切配合下，经过全体教师的辛勤耕耘和不懈努力，同盟小学的各项工作蓬勃发展，教育教学质量和校风校纪等学校工作突飞猛进，多次被评为镇教学质量先进单位。学校还十分重视健全人格的塑造，强化在活动交际中、社会交往中，培养学生文明礼貌、乐观进取、诚实正直的人格，使学生具有对祖国、对社会、对父母的高度责任感和自强不息和经受得起磨难和挫折的良好心理素质。,长沙县开慧镇石燕村410161,0731-86440473,147768477@qq.com,443574173@qq.com,13875943683,13875943683,村小,45,8,,1,1,1,1,1,1,,7,3,5,15,11,13,,0,,是,是,10,3,6,是,,3000
50,湖南省湘西永顺县石堤西湖片瑞云欣欣小学,湖南湘西,湘西州,永顺县,石堤镇,田洋,2003,,后续支持,教学设备,原欣欣学校,我校建设情况：      占地面积26600平方米，校舍面积12005平方米，教学及辅助用房面积2075平方米，运动场地面积4386平方米，以上所述情况和省级标准相靠严重不达标。           学校现有图书室一间，图书36000册；实验室一间，仪器设备紧缺；音乐室、美术室、多媒体教室、劳技室、计算机教室和语音室六大功能室各一间，室内教学设备和省级标准相靠严重不达标。,湖南省湘西州永順縣石堤鎮(石堤小学) 416700,18974374028,463804967@qq.com,,15174383087,15174383087,完全小学,2275,98,1,5,5,5,5,5,5,56,369,385,366,342,356,372,,76,,是,是,48,12,1,是,,
60,甘肃省敦煌市杨家桥乡鸣山兆基纪念欣欣小学,甘肃,酒泉市,敦煌市,杨家桥乡,张玉新,2003,2019,后续支持,教学设备,原欣欣学校,2019年访校时了解到教育局正在做规划，可能用二年时间来建立另一间学校,甘肃省敦煌县杨家桥乡鸣山村一组 736200,1320-9406896,923935876@qq.com,923935876@qq.com,1320-9406896,,完全小学,61,8,2,1,1,1,1,1,1,35,20,19,22,20,23,24,,0,,是,是,32,,,是,,
62,青海省互助土族自治县双树乡大沟信望爱欣欣小学,青海,海东市,互助土族自治县,双树乡,王文生,2003,2012,后续支持,教学设备,原欣欣学校,学校位于互助土族自治县塘川镇大沟村，学校占地面积 2252 平方米，建筑面积为 430 平方米，现有教师2名，学生20名，2个教学班。2002年10月，美国欣欣教育基金会慈善人士莅临大沟村，选定校址，并于2003捐资一万美元，7月10日破土动工，9月10日竣工。将学校更名为“信望爱欣欣小学”。2014年学校机构进行调整，将原塘川镇大沟小学更名为塘川镇大沟教学点，2015年进行了农村学校薄改项目，维修了校舍、硬化了操场。,"青海省海东市互助县塘川镇大沟村，	邮政编码810599",0972-8391699,772950346@qq.com,772950346@qq.com,13897712584,wxid_b8808ayl5vy022,教学点,20,2,0,1,1,0,0,0,0,0,10,10,0,0,0,0,,0,,否,否,,1,1,否,0,1200
78,湖南省汉寿县军山铺镇欣欣小学,湖南,常德市,汉寿县,军山铺镇,刘波,2004,2018,后续支持,教学设备,原欣欣学校,军山铺镇小现有23个教学班，有学生1015 人，教师48人，音体美专任教师7人，校园总面积为18574.5平方米，校舍总面积为 6902平方米，绿化面积为1535.7平方米，学生食堂面积 754平方米，是一所富有朝气、精神焕发、和谐进取、不断创新、成果突出的学校,湖南省常德市汉寿县军山铺镇  邮编415901,7362279888,jsp736@126.com,80669939@qq.com,13786606989,,中心小学,1090,42,0,5,5,4,4,5,5,0,238,236,244,214,265,256,862,518,,是,否,,3,,,,
87,广西壮族自治区防城十万山华侨林场垌平陈林若星欣欣小学,广西,防城港市,防城区,十万山瑶族乡,吕磊,2003,2017,后续支持,教学设备,原欣欣学校,我校得益于美国欣欣教育基金会的资助下，于2003年在垌平村老虎石岭，占地5303.01平方米建教学楼一幢8间，面积448平方米，服务范围19个村庄，现有6个班，学生187人，教师8人。又由于祖国日益发展，先后在教学楼东西两侧新建厕所一间，学生食堂一幢300平方米，食堂2016春季学期投入使用；围墙已竣工；进校道路已硬化；新教学楼正在建设。学校成立至今曾得到上级的多方关怀与支持，可硬化绿化未善，为美丽乡村，美化校园，我们决心因地制宜，坚持以人为本，全面提高教育质量，不辜负基金会对我们的殷切关怀。,广西省防城港市防城区十万山瑶族乡垌平村垌平小学538041,0770-3795239,dpxx3795239@163.com,dpxx3795239@163.com,13977073103,LV13977073103,村小,166,9,0,1,1,1,1,1,1,,34,29,25,26,34,29,,无,,是,否,,1,由于自然灾害及多种因素造成，投影仪已损坏,否,6,800
88,山东省微山县留庄镇桥上村梁明初欣欣小学,山东,济宁市,微山县,留庄镇,徐巍峰,2003,,后续支持,教学设备,原欣欣学校,学校占地5179平方米，主体建为三层教学楼。集教学、办公为一体，建筑面积为1396平方米。     学校六室配套，各室正常运行。我校拥有微机48台，多媒体2台，图书5000余册。2013年11月被市教育局授予“实验室建设规范化学校”荣誉称号，学校连续七年被镇党委政府评为教育教学工作先进单位。     学校现有9个教学班，在校学生290名。专任教师16人，其中一级教师6人，二级教师8人。市级优质课执教者3人，县教学能手、县优质课执教者4人。本科学历9人，专科学历4人，学历合格率100%。,山东省微山县留庄镇桥上村277642,13854749766,yang2966@126.com,yang2966@126.com,13854749766,13854749766,完全小学,166,23,3,1,1,1,1,1,1,87,29,31,17,24,29,36,,0,,是,是,21,20,1,,,
