131,甘肃省玉门市玉门镇代家滩村贵溥欣欣小学,甘肃,酒泉市,玉门市,玉门镇,刘进,2004,,后续支持,终止支持,已撤并,,甘肃省玉门市玉门镇代家滩村小学 735211,13369372878,1165515031@qq.com,djtlj@163.com,13369372878,,,,,,,,,,,,,,,,,,,,无,,,,,,现有一套系 2012年7月由贵基金会提供的电脑＋投影仪设备，目前仍用于教学活动，性能良好。,,,
141,宁夏固原市原州区甘城乡石景以琳欣欣小学,宁夏,中卫市,海原县,甘城乡,郭从新,2004,2017,后续支持,终止支持,已撤并,该校为原海原县石镜欣欣小学因没有学生而并入的乡甘城乡中心小学，校长表示不需要外来帮助。石镜欣欣小学校牌已取消。,宁夏中卫市海原县甘城乡甘城小学 755222,15008658683,923065676@qq.com,,,,九年制,272,16,1,,,,,,,32,,,,,,,,123,,,,,2,,,,3501
151,山西省吕梁市大禹乡樊家山广恩欣欣中心小学,山西,吕梁市,临县,大禹乡,曹理平,2004,,后续支持,终止支持,已撤并,目前已经没有学生，乡里的孩子都到县城上学。,山西省吕梁市临县大禹乡樊家山村 广恩欣欣中心小学 033206,0358-4596388,,,15135473855,,,,,,,,,,,,,,,,,,,,,,,,,,,,,
153,四川雅安市宝兴县穆坪镇林荣欣欣小学,四川,雅安市,宝兴县,穆坪镇,苟存金,2004,,后续支持,终止支持,已撤并,2019年9月学校已撤校 宝兴县穆坪镇林荣欣欣小学简介 宝兴县穆坪镇林荣欣欣小学位于宝兴县穆坪镇新光村胜利组1号，占地面积为1320平方米。现学校有教学班级6个，在校学生数88人。目前，学校共有教职工10人。 2013年受芦山“4.20”大地震影响，许多农户都还在灾后重建，由于地处山村，这里也没好的经济来源，造成了我校还有21个学生家庭比较贫困。 “4.20”大地震后，胜利小学都得到了社会团体、好心人士的很多关心与帮助，现在孩子们能在一个宽敞明亮的教室里上课了，在此对关心、帮助过胜利小学的社会团体、好人人士表示衷心感谢！,四川省雅安市宝兴县新光村胜利组1号，625700,0835-6821511,slxx6821511@163.com,314184480@qq.com,18981634039,G18981634039,村小,88,11,1,1,1,1,1,1,1,15,13,12,16,12,13,9,,0,,是,是,9,2,1,否,0,4109
154,四川长宁县开佛乡吴绍珍欣欣小学,四川,宜宾市,长宁县,长宁镇,罗平,2004,2019,后续支持,终止支持,已撤并,2021年8月学校撤校,四川省宜宾市长宁县开佛乡中心小学（罗建华 13778919096） 转 吴绍珍欣欣小学,15883104668,,13458812040@139.com,13458812040,lorense6688,村小,45,3,,,,,,,,,,,,,,,,,,,,,,,,,
160,黑龙江省绥化市北林区连岗乡张毓伟欣欣小学,黑龙江,绥化市,北林区,连岗乡,郝殿華,2004,,后续支持,终止支持,已撤并,学校2年前已经报停，项目已经收回，校长已退休两年，已跟外务长官谈过，并且有书面汇报，这个乡下面所有分校已被收回，孩子们去乡镇上学，中心教对学生进行车接车送，和乡里的中心教联系下一步资助计划，通过北林区教育局，连岗中心小学联系。,黑龙江 绥化市北林区 连岗乡 河东村152014/黑龙江省绥化县(市)连岗乡(镇)高兴(村),0455-8472015,37736257@qq.com,lifengxun520@126.com,13846711753,,,,,,,,,,,,,,,,,,,,,,,,,,,,,
171,辽宁省抚顺市清原县南口前镇十八道岭欣欣小学,辽宁,抚顺市,清原满族自治县,南口前镇,贾本源,2005,,后续支持,终止支持,已撤并,该学校于2013年水灾摧毁已撤并，后由另一个捐赠方重建一所学校。,抚顺市清原县南口前镇十八道岭113300,13904132095,shibadaoling@163.com,shibadaoling@163.com,13904132095,,完全小学,,,,,,,,,,,,,,,,,,,,否,是,,2,,,,
172,辽宁省锦州市北镇市大屯乡欣欣中心小学,辽宁,锦州市,北镇市,大屯乡,王建国,2005,,后续支持,终止支持,已撤并,"辽宁省锦州市北镇市大屯乡欣欣中心小学是一所农村小学	多年来重视素质教育	重视学生良好习惯的养成	是北镇市四星级学校	各项活动在全市小学行列中一直都名列前茅.现有13个教学班	400余名学生	教师30名	幼儿班3个	幼儿86名	幼师4名.2016年底新竣工4层2300平教学楼。师生已并校，原欣欣学校已撤并。",辽宁省锦州市北镇市大屯乡大屯村欣欣中心小学 121300,0416-6330021,bndtxx@163.com,,13634941310,,中心小学,405,30,3,2,2,2,2,2,3,86,53,60,55,70,77,90,,,,是,是,30台,10台,1套,是,,
192,湖南湘西凤凰县水打田乡红星片仲浩欣欣完全小学,湖南湘西,湘西州,凤凰县,水打田乡,杨晓华,2005,2018,后续支持,终止支持,已撤并,这所学校2007年建校，原来有300多人，因离县城比较近大部分学生都到县城去上学了，后来只剩23人，2017年撤并。现在的校舍做村委会办公室和留守儿童之家。,湖南  省     凤凰   县(市)     水打田    乡(镇) 红星 (村)416200,13739046968,1771688894@qq.com,1771688894@qq.com,17674326216,,完全小学,159,8,1,1,1,1,1,,,27,30,32,35,35,,,0,,,是,是,,,,,,
252,山东枣庄市陈山村法华欣欣小学,山东,枣庄市,山亭区,冯卯镇,侯贺珍,2006,,后续支持,终止支持,已撤并,"山东枣庄市法华欣欣小学现有教学班7个，在校学生149人，专任教师8人（本科5人、专科3人）、代课教师2人。近年来，学校教师队伍不断向年轻化、高学历化、专业化方向迈进，学历达标率100%。在广大师生的共同努力下，适龄儿童入学率达100%，学校连年被评为先进教学单位。学校以“抓好常规、夯实基础、崇尚道德、营造和谐、继承传统、勇于创新、以人为本、彰显特色”为办学理念，以""敬业、厚德、博学、创新”为目标，让学生乐学、善思、刻苦、奋进、广大师生以严谨、博学、善导、奉献为宗旨严于律己，积极开展工作，加强规范化管理。",山东省枣庄市山亭区冯卯镇陈山村，277214,13280287496,hhzxxjy@163.com,hhzxxjy@163.com,13280287496,wxid_gen9yujdl3gc22,完全小学,149,10,1,1,1,1,1,1,1,20,25,26,27,21,20,10,,0,,是,是,23,2,0,是,0,3750
259,四川阿埧州汶川县威州镇增坡欣欣小学,四川,阿坝藏族羌族自治州,汶川县,威州镇,王校长,2006,,后续支持,终止支持,已撤并,"已於2009年併入汶川县威州镇中心小学	 教育局不同意保留欣欣校名。",已于2009年并入汶川县威州镇中心小学,13990440792,,,13990440792,,,,,,,,,,,,,,,,,,,,,,,,,,,,,
271,湖北鄂州市梁子湖区沼山镇欣欣小学,湖北,鄂州市,梁子湖区,沼山镇,张绍宝,2007,2014,后续支持,终止支持,已撤并,该校于2007年改建为欣欣小学，当时有400学生。建校后直至2011年，每年都得到某些项目捐赠。 2012年当地一开发商经理捐资1650万元，政府投入1350万创办了一所全新的，大规模的现代化学校。新学校迁址，命名为“海博实验学校”。新学校于2013年9月开始使用，学生人数已达1400。学校条件已相当好，不再需要捐助。,湖北省鄂州市梁子湖区沼山镇居委会000000,15972553686,,,15972553686,,中心小学,1195,52,3,4,4,4,3,3,3,150,195,196,192,153,149,160,,,,,,,,,,,
277,贵州省六盘水市六枝特区县陇脚布依族乡月亮河贝克欣欣小学,贵州,六盘水市,六枝特区,陇脚布依族乡,,2007,2017,后续支持,终止支持,已撤并,,贵州省六枝特区陇脚乡月亮河,18985371849,583127907@qq.com,,,,,,,,,,,,,,,,,,,,,,,,,,,,,,,
291,河南省驻马店沁阳县付庒乡会灿欣欣中心小学,河南,驻马店市,沁阳县,付庄乡,薛瑞来,2007,,后续支持,终止支持,已撤并,,河南省驻马店泌阳县付庒乡,15039620333,810746107@qq.com,810746107@qq.com,15039620333,,,,,,,,,,,,,,,,,,,,,,,,,,,,,
298,四川叙州区双龙镇金山村林氏欣欣小学,四川,宜宾市,叙州区,双龙镇,罗均,2007,2015,后续支持,终止支持,已撤并,2021年8月学校撤并，师生被临时分到双龙镇小及邻近学校,四川省宜宾市宜宾县双龙镇金山村小学校    644614,13458477930,2717325166@qq.com,2717325166@qq.com,13458477930,13458477930,村小,86,6,1,1,,1,,1,1,18,11,14,,22,,21,,无,,否,否,无,无,欣欣捐赠一套。,否,,300
303,湖南省湘西吉首市白岩乡真光欣欣中心完小,湖南湘西,湘西州,吉首市,白岩乡,石东,2008,,后续支持,终止支持,已撤并,,湖南省吉首市白岩乡416007,13787928021,794920106@qq.com,312534313@qq.com,15874324097,sdwp123456,中心小学,182,28,1,1,1,1,1,1,2,52,30,32,40,46,36,40,,160,,是,是,52,10,1,,,
345,山西清徐县孟封镇齐南安尚琳欣欣小学,山西,太原市,清徐县,孟封镇,王晋文,2015,2016,后续支持,终止支持,已撤并,我位于清徐县孟封镇齐南安村，服务范围为齐南安、车南安、杨家堡三个自然村一千五百多人。学校占地面积3666平米，校舍建筑面积643平方米，由教学楼、乒乓球室、库房、厕所四个单体建筑组成，现在有教学班六个，学生45人，教师9人，是一所完全小学。,山西省清徐县孟封镇齐南安小学校  030400,0351-5722241,,shanxiwjw@126.com,13073535283,13073535283,教学点,45,9,1,1,1,1,1,1,1,11,9,6,4,8,6,12,0,0,,是,是,14,7,0,是,5,200
11,黑龙江省绥化市太平川镇欣欣小学,黑龙江,绥化市,北林区,太平川镇,闫洪峰,2000,2017,后续支持,基础设施,并校,学校现有教学班14个，学生396人，教师87人，学校开设课程齐全，能够满足全镇孩子入学。学校建有标准化食堂，能过满足全校学生一起用餐需要。教学质量较高，得到了家长的肯定。,黑龙江省绥化市北林区太平川镇，152012,0455-8492019,1405460098@qq.com,779986638@qq.com,13796588677,13796588677,中心小学,260,87,,2,3,3,3,3,,,,,,,,,,0,,是,是,6,1,1,是,18,6300
14,黑龙江省延寿县玉河乡欣欣小学,黑龙江,哈尔滨市,延寿县,玉河乡,李觉义,2000,2017,后续支持,基础设施,并校,,黑龙江哈尔滨市延寿县玉河乡黄玉村150772,13796663678,,2412813315@qq.com,13503657457,13503657457,完全小学,197,34,1,1,1,1,1,1,1,12,22,29,26,30,39,39,,,,是,是,40,7,1,是,6,4500
18,辽宁省法库县冯贝堡乡务名屯欣欣希望小学,辽宁,沈阳市,法库县,冯贝堡乡,张德民,2001,,后续支持,基础设施,并校,我根据辽宁省侨办李处长提供的信息打电话给张德民校长（13940367694），根据他的说法这个学校已经并入中心小学。- 童,辽宁省 法库县 冯贝堡镇 冯贝堡村110400,024-87034010,fbpzzx@163.com,,13940367694,,中心小学,553,65,,67,97,100,102,93,94,,,,,,,,,,,是,是,72,40,18,,,
57,四川省阿垻州九寨沟县安乐乡林氏欣欣小学,四川,阿坝藏族羌族自治州,九寨沟县,安乐乡,王幺成,2003,,后续支持,基础设施,并校,"第三小学地处县城边境公路北端结束处与九环线隔河相望的安乐乡中安乐村，距县城3公里，始建于1958年，新校园在上级的关怀下经过三年以建设于2003年9月9日正式启用，彻底改变了旧学校道路、校园狭窄、拥挤的环境。学校占地面积7795平方米，校舍建筑面积3314平方米，教师29人，中学高级教师1人，小学高级教师13人	少数民族教师16人，教师学历合格率为100%，男教师9人，女教师20人，党员13名。2006年开办寄宿制，现有寄宿制学生312人，住管教师2人，门卫2人。学校环境幽美，校园文化丰富多彩，教室宽敞明亮，计算机教室、科学实验室、图书室、体育器材保管室等功能室是设施齐备，有一个良好的育人环境。",四川省九寨沟县安乐乡中心校转下双河村林氏欣欣小学 623400,17761499222,463796589@qq.com,463796589@qq.com,17761499222,wyc7726518,中心小学,561,29,2,2,1,1,1,1,1,50,92,45,43,44,46,42,,312,,,是,45,3,,,,
58,宁夏中卫市海原县关桥乡中心小学,宁夏,中卫市,海原县,关桥乡,田进虎,2003,2017,后续支持,基础设施,并校,"关桥中心小学始建于1957年，地处关桥乡关桥村，现址在海同公路旁。学校占地面积12465平方米，现有建筑面积3632.6平方米，（其中教学楼1456平方米，综合楼1036平方米）。学校现有专任教师30人，教学班13个（其中学前班1个），学生488人，回族436人	女生220人，回女209人。",宁夏回族自治区中卫市海原县关桥乡关桥村中心小学 755213,9554651131,948447129@qq.com,599130839@qq.com,15809650919,wxid_zo4gn5c6d0ax22,中心小学,488,30,,2,1,1,2,3,3,,58,54,48,80,115,127,500,248,,是,是,45,20,1,否,12,5400
59,甘肃省玉门市柳河乡蘑菇滩庆华欣欣小学,甘肃,酒泉市,玉门市,柳河乡,万金刚,2003,,后续支持,基础设施,并校,柳河学校是一所农村寄宿制学校，现有11个教学班，328名学生，其中住宿生306名。现有教职工30人，专任教师30人，专科以上学历教师30人，中级职称14人，初级职称16人。,甘肃省玉门市柳河乡二道沟村 735215,9373386220,315708407@qq.com,550587399@qq.com,13299380289,13299380289,完全小学,327,30,4,1,2,2,2,2,2,135,42,64,49,58,54,61,,306,,是,是,35,30,1,,6,5000
69,宁夏海原县西安乡付套华华欣欣小学,宁夏,中卫市,海原县,西安乡,董学兴,2003,2017,后续支持,基础设施,并校,原欣欣学校并入了西安镇中心小学,宁夏中卫市海原县西安乡755200,15595495030,163459825@qq.com,2503786135@qq.com,15595495030,15309566001,中心小学,21,2,21,,,,,,,,,,,,,,,无,,否,是,12,1,,否,,659
76,辽宁省安山市岫岩县大营子镇王家堡村欣欣小学,辽宁,安山市,岫岩县,大营子镇,杨树海,2003,2018,后续支持,基础设施,并校,学校2018年并入大营子镇中心校,辽宁省安山市岫岩满族自治县大营子镇中心校 114314,15942218029,suizhongyu888@163.com,825522066@qq.com,13941214577,13941214577,中心小学,463,45,,2,2,2,2,2,2,,78,69,54,73,99,90,,,,是,是,31,115,,是,,
109,湖南省常德市桃源县青林回族维吾尔族乡智诚欣欣学校,湖南,常德市,桃源县,青林回族维吾尔族乡,郑杰,2004,2018,后续支持,基础设施,并校,我校位于桃源县城北郊，是一所历史悠久的乡中心小学。现有1-6年级20个教学班，幼儿园4个教学班，日校学生840人，幼儿150人，教职工52人，我校已通过合格学校验收，办学条件得到了进一步改善，我们全体师生会不懈努力把我校打造成为具有书香文化特色的令家长满意的农村小学。,湖南省常德市桃源县青林回族维吾尔族乡中学  415700,13875084648,254648189@qq.com,,18974243338,,中心小学,920,55,3,3,3,4,4,3,3,110,106,135,139,147,139,131,,0,,是,是,40,2,1,是,,18969
110,四川南充市嘉陵区郑家沟联合村林氏欣欣小学,四川,南充市,嘉陵区,双桂镇,周小强,2004,2018,后续支持,基础设施,并校,该校已经合并到所属中心乡中心小学，2008年已向基金会报告该情况。,四川省南充市嘉陵区太和小学 637980,13219121280,601737957@qq.com,601737957@qq.com,13219121280,F20169161,九年制,180,31,,,,,,,,,,,,,,,,,,,,,,,,,
209,四川省资阳市安岳县兴隆镇左家坪林氏欣欣学校,四川,资阳市,安岳县,兴隆镇,申娟,2005,2019,后续支持,基础设施,并校,2021年春季学期，原欣欣小学并入中心校，安岳县左家坪九年制学校，属于农村寄宿制学校，学校始建于1949年，2020年10月更名为安岳县左家坪九年制学校。现有教职工67人，其中公办在职教师33人，退休教师30人，临聘教师4人。    学校设初中部、小学部、幼教部，教学班14个，在校学生385名（其中初中部教学班6个，在校初中学生177名；中心校小学部教学班6个，在校小学生172名，幼教部2个班，在校学生36人）,四川省资阳市安岳县左家坪九年制学校（原兴隆镇界桥村撤并入中心校）邮编642362,18190299278,45741504@qq.com,45741504@qq.com,18190299209,jenny830920,九年制,426,37,2,1,1,1,1,1,1,36,18,25,30,29,31,39,177,174,,是,是,64,5,13,是,0,13641
214,湖南湘西龙山县水沙坪乡信望爱欣欣中心小学,湖南湘西,湘西州,龙山县,茅坪乡,尚道绩,2005,,后续支持,基础设施,并校,"茅坪乡九年制学校地处龙山县城南端，临二0九国道边沿的茅坪乡龙冠村，距县城22千米，属武陵山脉延伸至龙山境内的高山台地农村学校，它的前身是龙山县茅坪乡中心小学，2015年与茅坪乡金沙中学合校。下辖水沙坪完全小学，老场村小	一个中心幼儿园，四个民办幼儿园。近年来，在上级各部门领导的支持下，学校新修了一栋三层的教学楼，整修了运动场，兴建了一所中心幼儿园。自创建合格校以来，学校新装备了科学实验室，理、化、生实验室、多媒体室、图书室、阅览室等各功能室。",湖南省龙山县茅坪乡龙冠村416805,15874333106,lslhz0227@163.com,,13974377097,13974377097,九年制,282,63,1,1,1,1,1,1,1,55,33,34,38,40,47,38,,50,,是,是,,4,,是,,
216,山东东平县戴庙镇法华欣欣完全小学,山东,泰安市,东平县,戴庙镇,牛生光,2005,,后续支持,基础设施,并校,我校成立于1998年，为乡镇中心小学，2012年东平县戴庙乡法华欣欣小学并入中心小学。学校地处220国道西，属古运河故地，东临风光秀丽的东平湖，西滨母亲河黄河。学校根据小学生的特点和小学教育的特点，以培养学生习惯，为人生健康发展奠基为出发点，实施精细化管理，努力提高教育教学质量，促进了学校各项工作平稳而健康的发展。2012年被评为市级规范化学校，2015年被县委、县政府评为教学质量提升先进学校。现有教学班15个班，在校生647名。现有教职工27人，其中一级教师17人，二级教师10人。,山东省东平县戴庙镇南庄村   271514,15263078917,dm.zxxx@163.com,dpxnsg@163.com,15263078917,NSG1234567,中心小学,846,41,0,3,3,3,2,2,,,163,150,143,98,92,0,0,0,,是,是,60,21,18,是,13,20002
217,安徽省当涂县姑熟镇藏汉欣欣中心小学,安徽,马鞍山市,当涂县,姑孰镇,杭树华,2005,2017,后续支持,基础设施,并校,当涂县姑熟镇东山欣欣小学2008年合并到藏汉中心学校，现学校为马鞍山市文明单位、当涂县优秀学校，马鞍山信息技术试点项目学校，全国足球特色学校。,安徽省马鞍山市当涂县藏汉中心学校，243100,0555-2906659,87488198@qq.com,87488198@qq.com,18955551918,H87488198,中心小学,382,50,1,2,2,2,2,2,1,32,79,47,58,52,65,57,,0,,是,是,44,41,12,是,0,20574
221,四川省简阳市新市镇仁义村明山欣欣小学,四川,成都市,简阳市,新市街道,梁萍,2005,2018,后续支持,基础设施,并校,该校于2008年8月由欣欣教育基金会出资一万美元，财政配套资金7.3万元人民币共同出资修建。主要解决仁义村及附近游家村、新庙子村、松树村小学生读书问题。于2005年12月竣工。学校占地面积1772平方，建筑面积373平方，有教室7间，教师办公室一间，教师寝室2间，厕所一个。其后，欣欣教育基金会为学校配备了图书、学生及教师电脑，投影仪、电子琴等教学设备，微波炉等生活设备。2016年5月中心投资四万余元对明山欣欣小学进行校园文化建设，学校校貌变化巨大。校园文化建设验收获简城学区第一名。,四川省简阳市十里坝街道办仁义村七组邮编641422,028-27163047,hy7163047@sina.com,450540062@qq.com,15282269190,Jrah1920,九年制,225,27,,,,,1,,,,,,,5,,,,0,,否,否,,手提电脑一台,只有投影仪一台,是,,1500
253,贵州黔南州长顺县长寨镇扁木欣欣小学,贵州,黔南州,长顺县,长寨街道,韦光贤,2006,2018,后续支持,基础设施,并校,,"贵州省长顺縣长寨鄉 扁木村	 550000",13638004006,894762799@qq.com,weixiao13638004006@126.com,13638004006,13638004006,村小,144,14,,,,,,,,,,,,,,,,,,否,,,,,是,,500
267,黑龙江省齐齐哈尔市梅里斯达斡尔族区共和兆明欣欣小学,黑龙江,齐齐哈尔市,梅里斯达斡尔族区,共和镇,孟庆杰,2007,2017,后续支持,基础设施,并校,共和兆明欣欣小学与共和中学于2010年合并为共和学校，现有教职工84人，学生224余人。,黑龙江省齐齐哈尔市梅里斯达斡尔族区共和镇共和兆明欣欣小学161022,15765062345,1606796309@qq.com,mlszxmqj@163.com,15765062345,15765062345,九年制,450,59,2,1,1,1,2,2,2,30,19,32,24,38,38,44,232,0,,是,是,33,18,1,是,12,15000
268,安徽省和县张家集文白欣欣小学,安徽,马鞍山市,和县,香泉镇,王伟,2007,2017,后续支持,基础设施,并校,香泉镇张家集小学，又名和县香泉镇张家集文白欣欣小学，位于香泉镇张家集街道，坐落在香乌东路北侧，是一所全日制学校，学校历史悠久。教学楼于2011年12月竣工，并投入使用至今。学校现有8个教学班，175名学生，24名专任教师，高级职称教师3人，学历合格率100%，其中本科学历占79.2%，曾获得县级教坛新星1人、教学能手5人、骨干教师11人，获得市级荣誉称号11人。 学校环境优美，布局合理，教学硬件设施完善。目前学校占地15164平方米，建筑面积1735.5平方米，有建筑物2栋（教学楼和食堂）。,安徽省和县(市) 香泉镇张家集社区238254,5552564188,506083219@qq.com,506083219@qq.com,13956641861,ww5520055,完全小学,175,24,,1,1,1,2,2,1,175,28,26,26,34,39,22,,0,,是,是,41,24,0,是,,1000
278,贵州省六盘水市六枝特区折溪乡中寨贝克欣欣小学,贵州,六盘水市,六枝特区,折溪彝族乡,肖珩,2007,2017,后续支持,基础设施,并校,中寨贝克欣欣小学位于六枝与关岭的边界处，因为比较偏远，学校条件及师资力量不足，现在学校有150名学生，教职工13人，其中食堂工人二名，门卫一人，特岗教师五人。学校无住宿生，学生中午在学校就餐。厕所、食堂、图书室实验室都有，图书1000册。学校有篮球场一个，乒乓球桌两台，一块操场不平整。,贵州省六盘水市六枝特区月亮河彝族布依族苗族乡六堡小学  553400,18984423419,2574480871@qq.com,3134787318@qq.com,18908582119,x5814066,完全小学,131,11,0,1,1,1,1,1,1,,22,19,33,21,20,16,,,,是,否,,5,0,否,0,1000
281,安徽省桐城市新渡镇芦圩慈晖欣欣小学,安徽,安庆市,桐城市,新渡镇,胡长春,2007,2017,后续支持,基础设施,并校,桐城市新渡镇新安小学位于新渡镇镇区，学校大门正对206国道，学校占地面积8805平方，现有学生246人，7个教学班级，现有教师16人，学校条件较差，仍有基础设施改善需求（教学楼，操场，厨房，厕所等） 教学设备：学校条件一般，基础设施良好，但仍需要改善图书阅览设备（图书室，图书角）和电子化教学设备（如白板，电脑，微机室等） 主要偏向软件方面的支持。（如师资培训，师资培训，移动交流平台，校长培训等）,安徽省安庆市桐城市新渡镇新安小学231470,0556-6811570,1045597857@qq.com,1045597857@qq.com,18075378778,18075378778,完全小学,246,16,1,1,1,1,1,1,1,28,43,34,33,28,46,34,0,0,,是,是,15,9,0,是,6,2970
343,甘肃省敦煌市转渠口镇定西孙立欣欣小学,甘肃,酒泉市,敦煌市,转渠口镇,李勇,2014,2019,后续支持,基础设施,并校,学校2021年春季学期合并到转渠口中学， 现在学校有232人，小学部143人。,甘肃省敦煌市转渠口镇秦安村三组  736200,15339372666,68175151@qq.com,455328131@qq.com,18893625223,,九年制,232,34,3,1,1,1,1,1,1,37,24,15,17,17,28,42,89,87,,是,是,25,15,,是,,
37,辽宁省法库县依牛堡欣欣九年一贯制学校,辽宁,沈阳市,法库县,依牛堡,崔丰元,2002,,后续支持,师资培训,并校,辽宁省法库县花牛堡欣欣小学于2006年并入法库县依牛堡九年一贯制学校，校址由依牛堡镇花牛堡村搬迁至依牛堡镇依牛堡村。2013年初中部搬迁到法库县城，学校更名为法库县依牛堡镇中心小学。2017年3月14日，经法库县教育局批准，学校继续沿用“欣欣小学”名称，新校名为“依牛堡镇欣欣小学”。         依牛堡镇欣欣小学校园占地4.9万平方米，建筑面积1.8万平方米。教职工83人，22个教学班，在校学生683人。校内附设幼儿园，在园幼儿126人。,辽宁省法库依县牛堡乡依牛堡中心小学 110406,024-87149019,ynp888888@163.com,ynp888888@163.com,15840394988,15840394988,中心小学,683,83,4,3,3,4,4,4,4,126,95,98,112,120,120,138,,,,,,,,,,,
17,辽宁省辽阳县灯塔市古树子一匡欣欣希望小学,辽宁,辽阳市,灯塔市,大河南镇,郝丽娜,2001,2018,后续支持,师资培训,并校,2018年9月并入中心校,辽宁省灯塔市大河南镇中心小学 111316,0419-6532494,232468688@qq.com,541801367@qq.com,13555757273,13555757273,中心小学,180,24,,1,1,1,1,1,1,,15,30,27,33,31,44,,,,是,是,31,24,1,,,
39,云南省宾川县古底甸尾广恩欣欣小学,云南,大理白族自治州,宾川县,平顺镇,杞智,2002,2017,后续支持,师资培训,并校,原名“云南省大理州宾川县平川镇 古底乡甸尾村廣恩欣欣小学”，2008年撤并到“云南省大理州宾川县平顺镇古底完全小学”,云南省宾川县平川镇古底村委会古底完小 671611,0872-7317727,qizhi19620217@126.com,qizhi19620217@126.com,13887222386,,完全小学,292,23,,2,2,2,2,2,2,,47,38,59,51,51,54,,,,,否,,3,,是,,20000
